reasoning_category,design_question,reasoning_logic,design_implication,wcag_impact,performance_impact,cognitive_impact,decision_factors,alternative_approaches
desktop_card,如何设计桌面端卡片？,卡片内容+卡片布局+点击目标+卡片大小+无障碍,桌面卡片影响信息单元,影响点击目标在桌面卡片,影响卡片渲染性能,影响卡片理解和认知负荷,卡片内容、卡片布局、点击目标、卡片大小、无障碍,网格卡片、浮动卡片、并列卡片
mobile_list,如何设计移动端列表？,列表类型+列表项+触摸目标+列表高度+无障碍,移动列表影响信息浏览,影响触摸目标在移动列表,影响列表渲染性能,影响列表理解和认知负荷,列表类型、列表项、触摸目标、列表高度、无障碍,单列列表、分组列表、无限列表
desktop_list,如何设计桌面端列表？,列表类型+列表项+点击目标+列表高度+无障碍,桌面列表影响信息浏览,影响点击目标在桌面列表,影响列表渲染性能,影响列表理解和认知负荷,列表类型、列表项、点击目标、列表高度、无障碍,多列列表、分组列表、虚拟列表
mobile_grid,如何设计移动端网格？,网格内容+网格列数+触摸目标+网格间距+无障碍,移动网格影响信息展示,影响触摸目标在移动网格,影响网格渲染性能,影响网格理解和认知负荷,网格内容、网格列数、触摸目标、网格间距、无障碍,单列网格、双列网格、自适应网格
desktop_grid,如何设计桌面端网格？,网格内容+网格列数+点击目标+网格间距+无障碍,桌面网格影响信息展示,影响点击目标在桌面网格,影响网格渲染性能,影响网格理解和认知负荷,网格内容、网格列数、点击目标、网格间距、无障碍,多列网格、固定网格、自适应网格
mobile_table,如何设计移动端表格？,表格类型+列数+触摸目标+表格策略+无障碍,移动表格影响数据展示,影响触摸目标在移动表格,影响表格渲染性能,影响表格理解和认知负荷,表格类型、列数、触摸目标、表格策略、无障碍,响应式表格、卡片表格、隐藏列表格
desktop_table,如何设计桌面端表格？,表格类型+列数+点击目标+表格策略+无障碍,桌面表格影响数据展示,影响点击目标在桌面表格,影响表格渲染性能,影响表格理解和认知负荷,表格类型、列数、点击目标、表格策略、无障碍,固定表格、响应式表格、虚拟表格
mobile_chart,如何设计移动端图表？,图表类型+屏幕尺寸+触摸交互+简化策略+无障碍,移动图表影响数据可视化,影响图表替代文本可达性,影响图表渲染性能,影响图表理解和认知负荷,图表类型、屏幕尺寸、触摸交互、简化策略、无障碍,简化图表、关键图表、交互图表
desktop_chart,如何设计桌面端图表？,图表类型+屏幕尺寸+鼠标交互+详细策略+无障碍,桌面图表影响数据可视化,影响图表替代文本可达性,影响图表渲染性能,影响图表理解和认知负荷,图表类型、屏幕尺寸、鼠标交互、详细策略、无障碍,详细图表、多图表、交互图表
mobile_modal,如何设计移动端模态框？,模态内容+屏幕空间+关闭方式+触摸交互+无障碍,移动模态框影响任务专注,影响焦点陷阱在移动模态,影响模态渲染性能,影响模态理解和认知负荷,模态内容、屏幕空间、关闭方式、触摸交互、无障碍,全屏模态、底部模态、小模态
desktop_modal,如何设计桌面端模态框？,模态内容+屏幕空间+关闭方式+鼠标交互+无障碍,桌面模态框影响任务专注,影响焦点陷阱在桌面模态,影响模态渲染性能,影响模态理解和认知负荷,模态内容、屏幕空间、关闭方式、鼠标交互、无障碍,居中模态、侧边模态、小模态
mobile_dropdown,如何设计移动端下拉菜单？,选项数量+屏幕空间+选择方式+触摸交互+无障碍,移动下拉菜单影响选择效率,影响触摸目标在移动下拉,影响下拉渲染性能,影响下拉理解和认知负荷,选项数量、屏幕空间、选择方式、触摸交互、无障碍,底部弹出、全屏选择、级联选择
desktop_dropdown,如何设计桌面端下拉菜单？,选项数量+屏幕空间+选择方式+鼠标交互+无障碍,桌面下拉菜单影响选择效率,影响点击目标在桌面下拉,影响下拉渲染性能,影响下拉理解和认知负荷,选项数量、屏幕空间、选择方式、鼠标交互、无障碍,悬停下拉、点击下拉、级联下拉
mobile_tooltip,如何设计移动端提示框？,提示内容+触发方式+屏幕空间+触摸交互+无障碍,移动提示框影响信息获取,影响提示通知可达性,影响提示渲染性能,影响提示理解和认知负荷,提示内容、触发方式、屏幕空间、触摸交互、无障碍,点击提示、长按提示、底部提示
desktop_tooltip,如何设计桌面端提示框？,提示内容+触发方式+屏幕空间+鼠标交互+无障碍,桌面提示框影响信息获取,影响提示通知可达性,影响提示渲染性能,影响提示理解和认知负荷,提示内容、触发方式、屏幕空间、鼠标交互、无障碍,悬停提示、点击提示、焦点提示
mobile_tabs,如何设计移动端标签页？,标签数量+标签位置+内容切换+触摸交互+无障碍,移动标签页影响内容切换,影响触摸目标在移动标签,影响标签渲染性能,影响标签理解和认知负荷,标签数量、标签位置、内容切换、触摸交互、无障碍,顶部标签、底部标签、滑动标签
desktop_tabs,如何设计桌面端标签页？,标签数量+标签位置+内容切换+鼠标交互+无障碍,桌面标签页影响内容切换,影响点击目标在桌面标签,影响标签渲染性能,影响标签理解和认知负荷,标签数量、标签位置、内容切换、鼠标交互、无障碍,顶部标签、侧边标签、嵌套标签
mobile_accordion,如何设计移动端折叠面板？,面板数量+内容量+展开方式+触摸交互+无障碍,移动折叠面板影响内容展开,影响触摸目标在移动折叠,影响折叠渲染性能,影响折叠理解和认知负荷,面板数量、内容量、展开方式、触摸交互、无障碍,单开折叠、多开折叠、嵌套折叠
desktop_accordion,如何设计桌面端折叠面板？,面板数量+内容量+展开方式+鼠标交互+无障碍,桌面折叠面板影响内容展开,影响点击目标在桌面折叠,影响折叠渲染性能,影响折叠理解和认知负荷,面板数量、内容量、展开方式、鼠标交互、无障碍,单开折叠、多开折叠、嵌套折叠
mobile_carousel,如何设计移动端轮播图？,图片数量+自动播放+控制方式+触摸交互+无障碍,移动轮播图影响内容展示,影响触摸控制可达性,影响轮播渲染性能,影响轮播理解和认知负荷,图片数量、自动播放、控制方式、触摸交互、无障碍,滑动轮播、自动轮播、手动轮播
desktop_carousel,如何设计桌面端轮播图？,图片数量+自动播放+控制方式+鼠标交互+无障碍,桌面轮播图影响内容展示,影响鼠标控制可达性,影响轮播渲染性能,影响轮播理解和认知负荷,图片数量、自动播放、控制方式、鼠标交互、无障碍,滑动轮播、自动轮播、手动轮播
mobile_pagination,如何设计移动端分页？,内容数量+页数+屏幕空间+触摸交互+无障碍,移动分页影响浏览效率,影响触摸目标在移动分页,影响分页渲染性能,影响分页理解和认知负荷,内容数量、页数、屏幕空间、触摸交互、无障碍,简化分页、滑动分页、无限滚动
desktop_pagination,如何设计桌面端分页？,内容数量+页数+屏幕空间+鼠标交互+无障碍,桌面分页影响浏览效率,影响点击目标在桌面分页,影响分页渲染性能,影响分页理解和认知负荷,内容数量、页数、屏幕空间、鼠标交互、无障碍,详细分页、简化分页、跳转分页
mobile_search,如何设计移动端搜索？,搜索场景+结果展示+筛选选项+触摸交互+无障碍,移动搜索影响信息发现,影响触摸目标在移动搜索,影响搜索渲染性能,影响搜索理解和认知负荷,搜索场景、结果展示、筛选选项、触摸交互、无障碍,顶部搜索、底部搜索、全屏搜索
desktop_search,如何设计桌面端搜索？,搜索场景+结果展示+筛选选项+鼠标交互+无障碍,桌面搜索影响信息发现,影响点击目标在桌面搜索,影响搜索渲染性能,影响搜索理解和认知负荷,搜索场景、结果展示、筛选选项、鼠标交互、无障碍,顶部搜索、侧边搜索、全屏搜索
mobile_filter,如何设计移动端筛选？,筛选维度+筛选方式+屏幕空间+触摸交互+无障碍,移动筛选影响信息过滤,影响触摸目标在移动筛选,影响筛选渲染性能,影响筛选理解和认知负荷,筛选维度、筛选方式、屏幕空间、触摸交互、无障碍,底部筛选、全屏筛选、侧边筛选
desktop_filter,如何设计桌面端筛选？,筛选维度+筛选方式+屏幕空间+鼠标交互+无障碍,桌面筛选影响信息过滤,影响点击目标在桌面筛选,影响筛选渲染性能,影响筛选理解和认知负荷,筛选维度、筛选方式、屏幕空间、鼠标交互、无障碍,顶部筛选、侧边筛选、下拉筛选
mobile_sort,如何设计移动端排序？,排序维度+排序方式+屏幕空间+触摸交互+无障碍,移动排序影响信息组织,影响触摸目标在移动排序,影响排序渲染性能,影响排序理解和认知负荷,排序维度、排序方式、屏幕空间、触摸交互、无障碍,底部排序、下拉排序、按钮排序
desktop_sort,如何设计桌面端排序？,排序维度+排序方式+屏幕空间+鼠标交互+无障碍,桌面排序影响信息组织,影响点击目标在桌面排序,影响排序渲染性能,影响排序理解和认知负荷,排序维度、排序方式、屏幕空间、鼠标交互、无障碍,顶部排序、侧边排序、下拉排序
mobile_drawer,如何设计移动端抽屉？,抽屉内容+抽屉位置+打开方式+触摸交互+无障碍,移动抽屉影响信息展示,影响触摸目标在移动抽屉,影响抽屉渲染性能,影响抽屉理解和认知负荷,抽屉内容、抽屉位置、打开方式、触摸交互、无障碍,底部抽屉、侧边抽屉、全屏抽屉
desktop_drawer,如何设计桌面端抽屉？,抽屉内容+抽屉位置+打开方式+鼠标交互+无障碍,桌面抽屉影响信息展示,影响点击目标在桌面抽屉,影响抽屉渲染性能,影响抽屉理解和认知负荷,抽屉内容、抽屉位置、打开方式、鼠标交互、无障碍,侧边抽屉、底部抽屉、浮动抽屉
mobile_popup,如何设计移动端弹出窗口？,弹出内容+弹出时机+关闭方式+触摸交互+无障碍,移动弹出窗口影响信息传达,影响触摸关闭可达性,影响弹出渲染性能,影响弹出理解和认知负荷,弹出内容、弹出时机、关闭方式、触摸交互、无障碍,底部弹出、全屏弹出、小弹出
desktop_popup,如何设计桌面端弹出窗口？,弹出内容+弹出时机+关闭方式+鼠标交互+无障碍,桌面弹出窗口影响信息传达,影响鼠标关闭可达性,影响弹出渲染性能,影响弹出理解和认知负荷,弹出内容、弹出时机、关闭方式、鼠标交互、无障碍,居中弹出、侧边弹出、小弹出
mobile_overlay,如何设计移动端遮罩层？,遮罩类型+遮罩时机+遮罩透明度+触摸交互+无障碍,移动遮罩层影响视觉层次,影响触摸穿透可达性,影响遮罩渲染性能,影响遮罩理解和认知负荷,遮罩类型、遮罩时机、遮罩透明度、触摸交互、无障碍,全屏遮罩、部分遮罩、透明遮罩
desktop_overlay,如何设计桌面端遮罩层？,遮罩类型+遮罩时机+遮罩透明度+鼠标交互+无障碍,桌面遮罩层影响视觉层次,影响鼠标穿透可达性,影响遮罩渲染性能,影响遮罩理解和认知负荷,遮罩类型、遮罩时机、遮罩透明度、鼠标交互、无障碍,全屏遮罩、部分遮罩、透明遮罩
mobile_slider,如何设计移动端滑块？,滑块类型+滑块范围+触摸目标+触摸交互+无障碍,移动滑块影响数值选择,影响触摸目标在移动滑块,影响滑块渲染性能,影响滑块理解和认知负荷,滑块类型、滑块范围、触摸目标、触摸交互、无障碍,触摸滑块、步进滑块、双向滑块
desktop_slider,如何设计桌面端滑块？,滑块类型+滑块范围+点击目标+鼠标交互+无障碍,桌面滑块影响数值选择,影响点击目标在桌面滑块,影响滑块渲染性能,影响滑块理解和认知负荷,滑块类型、滑块范围、点击目标、鼠标交互、无障碍,点击滑块、拖动滑块、双向滑块
mobile_switch,如何设计移动端开关？,开关类型+开关状态+触摸目标+触摸交互+无障碍,移动开关影响二元选择,影响触摸目标在移动开关,影响开关渲染性能,影响开关理解和认知负荷,开关类型、开关状态、触摸目标、触摸交互、无障碍,拨动开关、按钮开关、滑动开关
desktop_switch,如何设计桌面端开关？,开关类型+开关状态+点击目标+鼠标交互+无障碍,桌面开关影响二元选择,影响点击目标在桌面开关,影响开关渲染性能,影响开关理解和认知负荷,开关类型、开关状态、点击目标、鼠标交互、无障碍,点击开关、拨动开关、切换开关
mobile_checkbox,如何设计移动端复选框？,复选框类型+选择数量+触摸目标+触摸交互+无障碍,移动复选框影响多选,影响触摸目标在移动复选,影响复选框渲染性能,影响复选框理解和认知负荷,复选框类型、选择数量、触摸目标、触摸交互、无障碍,标准复选框、列表复选框、卡片复选框
desktop_checkbox,如何设计桌面端复选框？,复选框类型+选择数量+点击目标+鼠标交互+无障碍,桌面复选框影响多选,影响点击目标在桌面复选,影响复选框渲染性能,影响复选框理解和认知负荷,复选框类型、选择数量、点击目标、鼠标交互、无障碍,标准复选框、列表复选框、卡片复选框
mobile_radio,如何设计移动端单选按钮？,单选类型+选择数量+触摸目标+触摸交互+无障碍,移动单选按钮影响单选,影响触摸目标在移动单选,影响单选渲染性能,影响单选理解和认知负荷,单选类型、选择数量、触摸目标、触摸交互、无障碍,标准单选、列表单选、卡片单选
desktop_radio,如何设计桌面端单选按钮？,单选类型+选择数量+点击目标+鼠标交互+无障碍,桌面单选按钮影响单选,影响点击目标在桌面单选,影响单选渲染性能,影响单选理解和认知负荷,单选类型、选择数量、点击目标、鼠标交互、无障碍,标准单选、列表单选、卡片单选
mobile_file_upload,如何设计移动端文件上传？,文件类型+上传方式+触摸目标+触摸交互+无障碍,移动文件上传影响文件选择,影响触摸选择可达性,影响上传渲染性能,影响上传理解和认知负荷,文件类型、上传方式、触摸目标、触摸交互、无障碍,相机上传、相册上传、文件管理器
desktop_file_upload,如何设计桌面端文件上传？,文件类型+上传方式+点击目标+鼠标交互+无障碍,桌面文件上传影响文件选择,影响鼠标选择可达性,影响上传渲染性能,影响上传理解和认知负荷,文件类型、上传方式、点击目标、鼠标交互、无障碍,拖拽上传、点击上传、文件管理器
mobile_date_picker,如何设计移动端日期选择？,日期类型+选择方式+屏幕空间+触摸交互+无障碍,移动日期选择影响日期输入,影响触摸选择可达性,影响日期渲染性能,影响日期理解和认知负荷,日期类型、选择方式、屏幕空间、触摸交互、无障碍,底部日历、全屏日历、滚动日历
desktop_date_picker,如何设计桌面端日期选择？,日期类型+选择方式+屏幕空间+鼠标交互+无障碍,桌面日期选择影响日期输入,影响鼠标选择可达性,影响日期渲染性能,影响日期理解和认知负荷,日期类型、选择方式、屏幕空间、鼠标交互、无障碍,弹出日历、下拉日历、内联日历
mobile_time_picker,如何设计移动端时间选择？,时间类型+选择方式+屏幕空间+触摸交互+无障碍,移动时间选择影响时间输入,影响触摸选择可达性,影响时间渲染性能,影响时间理解和认知负荷,时间类型、选择方式、屏幕空间、触摸交互、无障碍,滚动时间、底部时间、全屏时间
desktop_time_picker,如何设计桌面端时间选择？,时间类型+选择方式+屏幕空间+鼠标交互+无障碍,桌面时间选择影响时间输入,影响鼠标选择可达性,影响时间渲染性能,影响时间理解和认知负荷,时间类型、选择方式、屏幕空间、鼠标交互、无障碍,下拉时间、弹出时间、输入时间
mobile_color_picker,如何设计移动端颜色选择？,颜色类型+选择方式+屏幕空间+触摸交互+无障碍,移动颜色选择影响颜色输入,影响触摸选择可达性,影响颜色渲染性能,影响颜色理解和认知负荷,颜色类型、选择方式、屏幕空间、触摸交互、无障碍,简化颜色、色块选择、色板选择
desktop_color_picker,如何设计桌面端颜色选择？,颜色类型+选择方式+屏幕空间+鼠标交互+无障碍,桌面颜色选择影响颜色输入,影响鼠标选择可达性,影响颜色渲染性能,影响颜色理解和认知负荷,颜色类型、选择方式、屏幕空间、鼠标交互、无障碍,详细颜色、色轮选择、输入颜色
mobile_rating,如何设计移动端评分？,评分类型+评分方式+触摸目标+触摸交互+无障碍,移动评分影响评价输入,影响触摸选择可达性,影响评分渲染性能,影响评分理解和认知负荷,评分类型、评分方式、触摸目标、触摸交互、无障碍,星级评分、表情评分、数字评分
desktop_rating,如何设计桌面端评分？,评分类型+评分方式+点击目标+鼠标交互+无障碍,桌面评分影响评价输入,影响鼠标选择可达性,影响评分渲染性能,影响评分理解和认知负荷,评分类型、评分方式、点击目标、鼠标交互、无障碍,星级评分、表情评分、数字评分
mobile_textarea,如何设计移动端多行文本？,输入类型+行数限制+屏幕空间+触摸交互+无障碍,移动多行文本影响文本输入,影响触摸输入可达性,影响文本渲染性能,影响文本理解和认知负荷,输入类型、行数限制、屏幕空间、触摸交互、无障碍,自适应高度、固定高度、全屏输入
desktop_textarea,如何设计桌面端多行文本？,输入类型+行数限制+屏幕空间+鼠标交互+无障碍,桌面多行文本影响文本输入,影响鼠标输入可达性,影响文本渲染性能,影响文本理解和认知负荷,输入类型、行数限制、屏幕空间、鼠标交互、无障碍,自适应高度、固定高度、可调整高度
mobile_select,如何设计移动端选择器？,选项数量+选择方式+屏幕空间+触摸交互+无障碍,移动选择器影响选项选择,影响触摸选择可达性,影响选择渲染性能,影响选择理解和认知负荷,选项数量、选择方式、屏幕空间、触摸交互、无障碍,底部选择、全屏选择、滚动选择
desktop_select,如何设计桌面端选择器？,选项数量+选择方式+屏幕空间+鼠标交互+无障碍,桌面选择器影响选项选择,影响鼠标选择可达性,影响选择渲染性能,影响选择理解和认知负荷,选项数量、选择方式、屏幕空间、鼠标交互、无障碍,下拉选择、弹出选择、内联选择
mobile_autocomplete,如何设计移动端自动完成？,数据源+建议数量+屏幕空间+触摸交互+无障碍,移动自动完成影响输入效率,影响触摸选择可达性,影响自动完成渲染性能,影响自动完成理解和认知负荷,数据源、建议数量、屏幕空间、触摸交互、无障碍,下拉建议、内联建议、全屏建议
desktop_autocomplete,如何设计桌面端自动完成？,数据源+建议数量+屏幕空间+鼠标交互+无障碍,桌面自动完成影响输入效率,影响鼠标选择可达性,影响自动完成渲染性能,影响自动完成理解和认知负荷,数据源、建议数量、屏幕空间、鼠标交互、无障碍,下拉建议、内联建议、多列建议
mobile_tag_input,如何设计移动端标签输入？,标签类型+标签限制+屏幕空间+触摸交互+无障碍,移动标签输入影响标签选择,影响触摸标签可达性,影响标签渲染性能,影响标签理解和认知负荷,标签类型、标签限制、屏幕空间、触摸交互、无障碍,简化标签、选择标签、输入标签
desktop_tag_input,如何设计桌面端标签输入？,标签类型+标签限制+屏幕空间+鼠标交互+无障碍,桌面标签输入影响标签选择,影响鼠标标签可达性,影响标签渲染性能,影响标签理解和认知负荷,标签类型、标签限制、屏幕空间、鼠标交互、无障碍,详细标签、选择标签、输入标签
mobile_range_picker,如何设计移动端范围选择？,范围类型+选择方式+屏幕空间+触摸交互+无障碍,移动范围选择影响范围输入,影响触摸选择可达性,影响范围渲染性能,影响范围理解和认知负荷,范围类型、选择方式、屏幕空间、触摸交互、无障碍,滑块范围、日历范围、输入范围
desktop_range_picker,如何设计桌面端范围选择？,范围类型+选择方式+屏幕空间+鼠标交互+无障碍,桌面范围选择影响范围输入,影响鼠标选择可达性,影响范围渲染性能,影响范围理解和认知负荷,范围类型、选择方式、屏幕空间、鼠标交互、无障碍,滑块范围、日历范围、输入范围
mobile_stepper,如何设计移动端步骤器？,步骤数量+当前步骤+屏幕空间+触摸交互+无障碍,移动步骤器影响流程导航,影响触摸导航可达性,影响步骤渲染性能,影响步骤理解和认知负荷,步骤数量、当前步骤、屏幕空间、触摸交互、无障碍,简化步骤、详细步骤、进度步骤
desktop_stepper,如何设计桌面端步骤器？,步骤数量+当前步骤+屏幕空间+鼠标交互+无障碍,桌面步骤器影响流程导航,影响鼠标导航可达性,影响步骤渲染性能,影响步骤理解和认知负荷,步骤数量、当前步骤、屏幕空间、鼠标交互、无障碍,简化步骤、详细步骤、进度步骤
mobile_tree_view,如何设计移动端树形视图？,树深度+节点数量+屏幕空间+触摸交互+无障碍,移动树形视图影响层级浏览,影响触摸展开可达性,影响树形渲染性能,影响树形理解和认知负荷,树深度、节点数量、屏幕空间、触摸交互、无障碍,简化树形、折叠树形、展开树形
desktop_tree_view,如何设计桌面端树形视图？,树深度+节点数量+屏幕空间+鼠标交互+无障碍,桌面树形视图影响层级浏览,影响鼠标展开可达性,影响树形渲染性能,影响树形理解和认知负荷,树深度、节点数量、屏幕空间、鼠标交互、无障碍,详细树形、折叠树形、展开树形
mobile_breadcrumb,如何设计移动端面包屑？,层级深度+当前层级+屏幕空间+触摸交互+无障碍,移动面包屑影响层级导航,影响触摸导航可达性,影响面包屑渲染性能,影响面包屑理解和认知负荷,层级深度、当前层级、屏幕空间、触摸交互、无障碍,简化面包屑、隐藏面包屑、返回按钮
desktop_breadcrumb,如何设计桌面端面包屑？,层级深度+当前层级+屏幕空间+鼠标交互+无障碍,桌面面包屑影响层级导航,影响鼠标导航可达性,影响面包屑渲染性能,影响面包屑理解和认知负荷,层级深度、当前层级、屏幕空间、鼠标交互、无障碍,详细面包屑、简化面包屑、可点击面包屑
mobile_status_bar,如何设计移动端状态栏？,状态类型+状态位置+屏幕空间+触摸交互+无障碍,移动状态栏影响状态展示,影响触摸状态可达性,影响状态栏渲染性能,影响状态栏理解和认知负荷,状态类型、状态位置、屏幕空间、触摸交互、无障碍,顶部状态栏、底部状态栏、浮动状态栏
desktop_status_bar,如何设计桌面端状态栏？,状态类型+状态位置+屏幕空间+鼠标交互+无障碍,桌面状态栏影响状态展示,影响鼠标状态可达性,影响状态栏渲染性能,影响状态栏理解和认知负荷,状态类型、状态位置、屏幕空间、鼠标交互、无障碍,顶部状态栏、底部状态栏、侧边状态栏
mobile_action_bar,如何设计移动端操作栏？,操作数量+操作位置+屏幕空间+触摸交互+无障碍,移动操作栏影响快速操作,影响触摸操作可达性,影响操作栏渲染性能,影响操作栏理解和认知负荷,操作数量、操作位置、屏幕空间、触摸交互、无障碍,顶部操作栏、底部操作栏、浮动操作栏
desktop_action_bar,如何设计桌面端操作栏？,操作数量+操作位置+屏幕空间+鼠标交互+无障碍,桌面操作栏影响快速操作,影响鼠标操作可达性,影响操作栏渲染性能,影响操作栏理解和认知负荷,操作数量、操作位置、屏幕空间、鼠标交互、无障碍,顶部操作栏、底部操作栏、侧边操作栏
