reasoning_category,design_question,reasoning_logic,design_implication,wcag_impact,performance_impact,cognitive_impact,decision_factors,alternative_approaches
mobile_context_menu,如何设计移动端上下文菜单？,菜单项数量+触发方式+屏幕空间+触摸交互+无障碍,移动上下文菜单影响快捷操作,影响触摸菜单可达性,影响菜单渲染性能,影响菜单理解和认知负荷,菜单项数量、触发方式、屏幕空间、触摸交互、无障碍,长按菜单、滑动菜单、点击菜单
desktop_context_menu,如何设计桌面端上下文菜单？,菜单项数量+触发方式+屏幕空间+鼠标交互+无障碍,桌面上下文菜单影响快捷操作,影响鼠标菜单可达性,影响菜单渲染性能,影响菜单理解和认知负荷,菜单项数量、触发方式、屏幕空间、鼠标交互、无障碍,右键菜单、悬停菜单、按钮菜单
mobile_quick_action,如何设计移动端快捷操作？,操作类型+触发方式+屏幕空间+触摸交互+无障碍,移动快捷操作影响操作效率,影响触摸操作可达性,影响快捷操作渲染性能,影响快捷操作理解和认知负荷,操作类型、触发方式、屏幕空间、触摸交互、无障碍,滑动操作、双击操作、长按操作
desktop_quick_action,如何设计桌面端快捷操作？,操作类型+触发方式+屏幕空间+鼠标交互+无障碍,桌面快捷操作影响操作效率,影响鼠标操作可达性,影响快捷操作渲染性能,影响快捷操作理解和认知负荷,操作类型、触发方式、屏幕空间、鼠标交互、无障碍,快捷键、右键操作、双击操作
mobile_pull_refresh,如何设计移动端下拉刷新？,刷新类型+触发方式+屏幕空间+触摸交互+无障碍,移动下拉刷新影响内容更新,影响触摸刷新可达性,影响下拉刷新渲染性能,影响下拉刷新理解和认知负荷,刷新类型、触发方式、屏幕空间、触摸交互、无障碍,下拉刷新、按钮刷新、自动刷新
desktop_auto_refresh,如何设计桌面端自动刷新？,刷新类型+刷新频率+用户控制+无障碍通知+无障碍,桌面自动刷新影响内容更新,影响刷新通知可达性,影响自动刷新性能,影响自动刷新理解和认知负荷,刷新类型、刷新频率、用户控制、无障碍通知、无障碍,定时刷新、手动刷新、混合刷新
mobile_swipe_navigation,如何设计移动端滑动导航？,导航类型+滑动方向+屏幕空间+触摸交互+无障碍,移动滑动导航影响页面切换,影响触摸导航可达性,影响滑动导航渲染性能,影响滑动导航理解和认知负荷,导航类型、滑动方向、屏幕空间、触摸交互、无障碍,左滑导航、右滑导航、边缘滑动
desktop_keyboard_navigation,如何设计桌面端键盘导航？,导航类型+快捷键+焦点管理+无障碍+一致性,桌面键盘导航影响导航效率,影响键盘焦点可达性,影响键盘导航性能,影响键盘导航理解和认知负荷,导航类型、快捷键、焦点管理、无障碍、一致性,Tab导航、方向键导航、快捷键导航
mobile_haptic_feedback,如何设计移动端触觉反馈？,反馈类型+触发时机+反馈强度+无障碍替代+性能,移动触觉反馈影响交互反馈,影响触觉替代可达性,影响触觉触发性能,影响触觉反馈理解和认知负荷,反馈类型、触发时机、反馈强度、无障碍替代、性能,轻触反馈、强触反馈、震动反馈
desktop_sound_feedback,如何设计桌面端声音反馈？,反馈类型+触发时机+音量控制+无障碍替代+性能,桌面声音反馈影响交互反馈,影响声音替代可达性,影响声音播放性能,影响声音反馈理解和认知负荷,反馈类型、触发时机、音量控制、无障碍替代、性能,提示音、警告音、成功音
mobile_gesture_control,如何设计移动端手势控制？,手势类型+手势复杂度+触发条件+无障碍替代+性能,移动手势控制影响交互效率,影响手势替代可达性,影响手势识别性能,影响手势控制理解和认知负荷,手势类型、手势复杂度、触发条件、无障碍替代、性能,简单手势、复杂手势、自定义手势
desktop_voice_control,如何设计桌面端语音控制？,语音类型+语音准确度+触发方式+无障碍替代+性能,桌面语音控制影响交互效率,影响语音替代可达性,影响语音识别性能,影响语音控制理解和认知负荷,语音类型、语音准确度、触发方式、无障碍替代、性能,语音命令、语音输入、语音导航
mobile_eye_tracking,如何设计移动端眼动追踪？,追踪类型+追踪准确度+触发方式+无障碍替代+性能,移动眼动追踪影响交互效率,影响眼动替代可达性,影响眼动识别性能,影响眼动追踪理解和认知负荷,追踪类型、追踪准确度、触发方式、无障碍替代、性能,眼动选择、眼动导航、眼动控制
desktop_brain_interface,如何设计桌面端脑机接口？,接口类型+接口准确度+触发方式+无障碍替代+性能,桌面脑机接口影响交互效率,影响脑机替代可达性,影响脑机识别性能,影响脑机接口理解和认知负荷,接口类型、接口准确度、触发方式、无障碍替代、性能,脑机选择、脑机导航、脑机控制